{
  "schemaVersion": 1,
  "month": "2026-12",
  "source": {
    "pdfUrl": "https://www.talence.fr/wp-content/uploads/2026/10/12-MENUS-WEB-DECEMBRE-2026.pdf",
    "pdfSha256": "6de537676c5ef6e4ed9e87ec704ff1295ebfb198bf1e287e846e6cfd23b72aab",
    "updatedLabel": null,
    "updatedAt": null,
    "fetchedAt": "2026-10-17T08:23:02Z",
    "producerVersion": "extract-menu-pdf/1"
  },
  "allergenLegend": {
    "1": "Gluten (blé, seigle, orge, avoine, épeautre, kamut)",
    "2": "Crustacés",
    "3": "Œufs",
    "4": "Poisson",
    "5": "Arachides",
    "6": "Soja",
    "7": "Lait",
    "8": "Fruits à coques (amandes, noisettes, noix, pistaches)",
    "9": "Céleri",
    "10": "Moutarde",
    "11": "Graines de sésame",
    "12": "Anhydride sulfureux et sulfites",
    "13": "Lupin",
    "14": "Mollusques"
  },
  "days": [
    {
      "date": "2026-11-30",
      "kind": "school",
      "confidence": "high",
      "courses": [
        {
          "slot": "pain",
          "label": "Pain",
          "allergens": [1],
          "flags": ["label-rouge"]
        },
        {
          "slot": "entree",
          "label": "Œufs durs mayonnaise",
          "allergens": [3, 10],
          "flags": []
        },
        {
          "slot": "plat",
          "label": "Cordon Bleu",
          "allergens": [1, 3, 7],
          "flags": []
        },
        {
          "slot": "accompagnement",
          "label": "Julienne de légumes",
          "allergens": [9],
          "flags": ["bio"]
        },
        {
          "slot": "laitage",
          "label": "Fromage",
          "allergens": [7],
          "flags": ["bio"]
        },
        {
          "slot": "dessert",
          "label": "Fruit de saison",
          "allergens": [],
          "flags": ["bio"]
        },
        {
          "slot": "gouter",
          "label": "Pain + Flan caramel",
          "allergens": [1, 7],
          "flags": []
        }
      ]
    },
    {
      "date": "2026-12-01",
      "kind": "school",
      "confidence": "high",
      "courses": [
        {
          "slot": "pain",
          "label": "Pain",
          "allergens": [1],
          "flags": ["bio"]
        },
        {
          "slot": "entree",
          "label": "Salade de tomates basilic",
          "allergens": [10, 12],
          "flags": ["bio"]
        },
        {
          "slot": "plat",
          "label": "Pizza des Cîmes",
          "allergens": [1, 7],
          "flags": []
        },
        {
          "slot": "accompagnement",
          "label": "Salade verte",
          "allergens": [10, 12],
          "flags": []
        },
        {
          "slot": "laitage",
          "label": "Fromage blanc nature",
          "allergens": [7],
          "flags": ["bio"]
        },
        {
          "slot": "dessert",
          "label": "Compote de pommes",
          "allergens": [],
          "flags": ["bio"]
        },
        {
          "slot": "gouter",
          "label": "Barre bretonne",
          "allergens": [1, 3, 7, 8],
          "flags": []
        }
      ]
    },
    {
      "date": "2026-12-02",
      "kind": "school",
      "confidence": "high",
      "courses": [
        {
          "slot": "pain",
          "label": "Pain",
          "allergens": [1],
          "flags": ["label-rouge"]
        },
        {
          "slot": "entree",
          "label": "Céleri rémoulade",
          "allergens": [3, 7, 9, 10],
          "flags": ["bio"]
        },
        {
          "slot": "plat",
          "label": "Blanquette de veau",
          "allergens": [7, 9, 10],
          "flags": []
        },
        {
          "slot": "accompagnement",
          "label": "Riz",
          "allergens": [],
          "flags": ["bio"]
        },
        {
          "slot": "dessert",
          "label": "Crème vanille",
          "allergens": [7],
          "flags": []
        },
        {
          "slot": "gouter",
          "label": "Goûter",
          "allergens": [1, 3, 7, 8],
          "flags": []
        }
      ]
    },
    {
      "date": "2026-12-03",
      "kind": "school",
      "confidence": "high",
      "courses": [
        {
          "slot": "pain",
          "label": "Pain",
          "allergens": [1],
          "flags": ["label-rouge"]
        },
        {
          "slot": "entree",
          "label": "Cake maison",
          "allergens": [1, 3, 7, 8],
          "flags": []
        },
        {
          "slot": "plat",
          "label": "Rôti de dinde",
          "allergens": [9],
          "flags": []
        },
        {
          "slot": "accompagnement",
          "label": "Ratatouille",
          "allergens": [7, 9],
          "flags": ["bio"]
        },
        {
          "slot": "laitage",
          "label": "Petit Suisse",
          "allergens": [7],
          "flags": ["bio"]
        },
        {
          "slot": "dessert",
          "label": "Fruit de saison",
          "allergens": [],
          "flags": ["bio"]
        },
        {
          "slot": "gouter",
          "label": "Pain + Crème de marron",
          "allergens": [1],
          "flags": []
        }
      ]
    },
    {
      "date": "2026-12-04",
      "kind": "school",
      "confidence": "high",
      "courses": [
        {
          "slot": "pain",
          "label": "Pain",
          "allergens": [1],
          "flags": ["bio"]
        },
        {
          "slot": "entree",
          "label": "Carottes râpées vinaigrette",
          "allergens": [10, 12],
          "flags": ["bio"]
        },
        {
          "slot": "plat",
          "label": "Fish'n'Chips",
          "allergens": [1, 4, 7],
          "flags": []
        },
        {
          "slot": "accompagnement",
          "label": "Haricots plats",
          "allergens": [],
          "flags": ["bio"]
        },
        {
          "slot": "dessert",
          "label": "Riz au lait",
          "allergens": [1, 7],
          "flags": ["bio"]
        },
        {
          "slot": "gouter",
          "label": "Biscuit Bio + Cocktail de fruits",
          "allergens": [1, 3, 7, 8],
          "flags": []
        }
      ]
    },
    {
      "date": "2026-12-07",
      "kind": "school",
      "confidence": "high",
      "courses": [
        {
          "slot": "pain",
          "label": "Pain",
          "allergens": [1],
          "flags": ["label-rouge"]
        },
        {
          "slot": "entree",
          "label": "Macédoine de légumes",
          "allergens": [3, 7, 10, 12],
          "flags": ["bio"]
        },
        {
          "slot": "plat",
          "label": "Boulettes de bœuf sauce Tex Mex",
          "allergens": [9],
          "flags": []
        },
        {
          "slot": "accompagnement",
          "label": "Blé",
          "allergens": [1],
          "flags": ["bio"]
        },
        {
          "slot": "laitage",
          "label": "Fromage",
          "allergens": [7],
          "flags": ["bio"]
        },
        {
          "slot": "dessert",
          "label": "Fruit",
          "allergens": [],
          "flags": ["bio"]
        },
        {
          "slot": "gouter",
          "label": "Biscuit Bio + Lait chocolaté",
          "allergens": [1, 3, 7, 8],
          "flags": []
        }
      ]
    },
    {
      "date": "2026-12-08",
      "kind": "school",
      "confidence": "high",
      "courses": [
        {
          "slot": "pain",
          "label": "Pain",
          "allergens": [1],
          "flags": ["bio"]
        },
        {
          "slot": "entree",
          "label": "Chou chinois vinaigrette",
          "allergens": [10, 12],
          "flags": []
        },
        {
          "slot": "plat",
          "label": "Lasagnes aux légumes",
          "allergens": [1, 3, 7, 9],
          "flags": []
        },
        {
          "slot": "laitage",
          "label": "Yaourt à boire",
          "allergens": [7],
          "flags": ["bio"]
        },
        {
          "slot": "dessert",
          "label": "Muffin au chocolat",
          "allergens": [1, 3, 7, 8],
          "flags": []
        },
        {
          "slot": "gouter",
          "label": "Pain Bio + Compote Bio",
          "allergens": [1],
          "flags": []
        }
      ]
    },
    {
      "date": "2026-12-09",
      "kind": "school",
      "confidence": "high",
      "courses": [
        {
          "slot": "pain",
          "label": "Pain",
          "allergens": [1],
          "flags": ["label-rouge"]
        },
        {
          "slot": "entree",
          "label": "Potage légumes vermicelles",
          "allergens": [1, 9],
          "flags": ["bio"]
        },
        {
          "slot": "plat",
          "label": "Tajine de mouton",
          "allergens": [8, 12],
          "flags": []
        },
        {
          "slot": "accompagnement",
          "label": "Semoule",
          "allergens": [1],
          "flags": ["bio"]
        },
        {
          "slot": "laitage",
          "label": "Fromage",
          "allergens": [7],
          "flags": ["bio"]
        },
        {
          "slot": "dessert",
          "label": "Fruit de saison",
          "allergens": [],
          "flags": ["bio"]
        },
        {
          "slot": "gouter",
          "label": "Goûter",
          "allergens": [1, 3, 7, 8],
          "flags": []
        }
      ]
    },
    {
      "date": "2026-12-10",
      "kind": "school",
      "confidence": "high",
      "courses": [
        {
          "slot": "pain",
          "label": "Pain",
          "allergens": [1],
          "flags": ["label-rouge"]
        },
        {
          "slot": "entree",
          "label": "Endives aux noix",
          "allergens": [8, 10, 12],
          "flags": ["bio"]
        },
        {
          "slot": "plat",
          "label": "Jambon blanc*",
          "allergens": [9],
          "flags": []
        },
        {
          "slot": "accompagnement",
          "label": "Gratin d'épinards",
          "allergens": [1, 7],